{
    "schema_version": "1.0",
    "id": "DEC-20250714-001",
    "created_at": "2025-07-14T09:00:00Z",
    "created_by": "Beth",
    "linked_intent_id": "INT-20250714-001",
    "project_id": "ASPACE-CORE",
    "signal_level": "green",
    "gate": "BETH",
    "type4_question": "Doit-on valider le déploiement du MCP Gateway malgré le coût LD04 ?",
    "options": [
        {
            "option": "A",
            "label": "Oui, déploiement immédiat"
        },
        {
            "option": "B",
            "label": "Non, reporter à la Q4"
        }
    ],
    "recommendation": "Option A : Vital pour l'autonomie agentique.",
    "rationale_10_lines_max": [
        "Souveraineté des données",
        "Réduction de latence",
        "Alignement Ikigai (LD04)"
    ],
    "deadline": "2025-07-15T09:00:00Z",
    "a0_decision": {
        "selected_option": "A",
        "decided_at": "2025-07-14T10:00:00Z",
        "decided_by": "Amadeus",
        "notes": "Validé. Priorité haute."
    }
}